{
  "schema_version": "1.0.0",
  "document_type": "SOURCE_AUTHORITY",
  "authority_id": "modularagent-figure2-critical-v1",
  "status": "FROZEN",
  "source": {
    "relative_path": "examples/01_2026_CVPR_2026_ModularAgent_A_Task-Aware_Modular_Framework_for_Join.png",
    "sha256": "792A16D4BD2C26CCA9FCA79668395A987825AB75EB2BC8A65F2D42A47C38A340",
    "width_px": 1429,
    "height_px": 627,
    "pixel_format": "RGB",
    "user_confirmed": true
  },
  "provenance": {
    "authority_kind": "MIXED",
    "title": "ModularAgent: A Task-Aware Modular Framework for Joint Optimization of Multimodal Large Language Models and World Models",
    "bibliographic_citation": "Yu-Wei Zhan, Xin Wang, Pengzhe Mao, Tongtong Feng, Ren Wang, and Wenwu Zhu. CVPR 2026, pp. 8087-8096.",
    "source_url": "https://openaccess.thecvf.com/content/CVPR2026/html/Zhan_ModularAgent_A_Task-Aware_Modular_Framework_for_Joint_Optimization_of_Multimodal_CVPR_2026_paper.html",
    "figure_locator": "Figure 2; method sections 3.1-3.3; arXiv:2512.04513 contains the corresponding primary-source equations"
  },
  "policy": {
    "ocr_may_confirm": false,
    "vlm_may_confirm": false,
    "pixels_may_authorize_text": false,
    "unmatched_candidates": "INCONCLUSIVE"
  },
  "items": [
    {
      "authority_item_id": "AUTH-0001",
      "subject_id": "region.task-prompt",
      "kind": "SEMANTIC_REGION",
      "disposition": "CONFIRMED",
      "criticality": "critical",
      "bbox_source": {"x": 28, "y": 14, "w": 362, "h": 80},
      "text": null,
      "label": "Task instruction input",
      "canonical_latex": null,
      "latex_sha256": null,
      "formula_mode": null,
      "relation": null,
      "source_evidence": [{"kind": "source_text", "locator": "Method 3.1, Eq. (1)", "detail": "The method begins from a task instruction y and encodes it into a task embedding."}],
      "notes": "Spatial box is an observation bound to the selected source, not promoted geometry truth."
    },
    {
      "authority_item_id": "AUTH-0002",
      "subject_id": "region.task-encoder",
      "kind": "SEMANTIC_REGION",
      "disposition": "CONFIRMED",
      "criticality": "critical",
      "bbox_source": {"x": 434, "y": 17, "w": 125, "h": 78},
      "text": null,
      "label": "Task Encoder",
      "canonical_latex": null,
      "latex_sha256": null,
      "formula_mode": null,
      "relation": null,
      "source_evidence": [{"kind": "source_text", "locator": "Method 3.1, Eq. (1)", "detail": "Task Encoder is an explicit component of the dynamic joint architecture."}],
      "notes": ""
    },
    {
      "authority_item_id": "AUTH-0003",
      "subject_id": "region.task-embedding",
      "kind": "SEMANTIC_REGION",
      "disposition": "CONFIRMED",
      "criticality": "critical",
      "bbox_source": {"x": 585, "y": 35, "w": 141, "h": 48},
      "text": null,
      "label": "Task embedding tokens",
      "canonical_latex": null,
      "latex_sha256": null,
      "formula_mode": null,
      "relation": null,
      "source_evidence": [{"kind": "source_text", "locator": "Method 3.1, Eq. (1)", "detail": "The task encoder produces the global task embedding tau used for routing."}],
      "notes": ""
    },
    {
      "authority_item_id": "AUTH-0004",
      "subject_id": "region.task-mapping",
      "kind": "SEMANTIC_REGION",
      "disposition": "CONFIRMED",
      "criticality": "critical",
      "bbox_source": {"x": 764, "y": 35, "w": 188, "h": 48},
      "text": null,
      "label": "Task-to-latent mapping",
      "canonical_latex": null,
      "latex_sha256": null,
      "formula_mode": null,
      "relation": null,
      "source_evidence": [{"kind": "source_text", "locator": "Method 3.2, Eq. (7)", "detail": "f_map projects the task embedding into the world-model latent space."}],
      "notes": ""
    },
    {
      "authority_item_id": "AUTH-0005",
      "subject_id": "region.modular-joint",
      "kind": "SEMANTIC_REGION",
      "disposition": "CONFIRMED",
      "criticality": "critical",
      "bbox_source": {"x": 19, "y": 107, "w": 945, "h": 412},
      "text": null,
      "label": "Task-Aware Modular Joint Learning",
      "canonical_latex": null,
      "latex_sha256": null,
      "formula_mode": null,
      "relation": null,
      "source_evidence": [{"kind": "source_text", "locator": "Method 3.1", "detail": "The left subsystem jointly learns semantic and dynamic representations under task guidance."}],
      "notes": "The target image shortens the displayed heading; exact visible wording remains a review candidate."
    },
    {
      "authority_item_id": "AUTH-0006",
      "subject_id": "region.expert-allocator",
      "kind": "SEMANTIC_REGION",
      "disposition": "CONFIRMED",
      "criticality": "critical",
      "bbox_source": {"x": 484, "y": 131, "w": 354, "h": 80},
      "text": null,
      "label": "Task-Guided Expert Allocator",
      "canonical_latex": null,
      "latex_sha256": null,
      "formula_mode": null,
      "relation": null,
      "source_evidence": [{"kind": "source_text", "locator": "Method 3.1, Task-Guided Expert Allocator", "detail": "A task-conditioned gate controls semantic and dynamics expert activation per layer."}],
      "notes": "Includes the allocator header and its fan-out wedge."
    },
    {
      "authority_item_id": "AUTH-0007",
      "subject_id": "region.mllm-encoder",
      "kind": "SEMANTIC_REGION",
      "disposition": "CONFIRMED",
      "criticality": "critical",
      "bbox_source": {"x": 188, "y": 241, "w": 125, "h": 78},
      "text": null,
      "label": "MLLM Encoder",
      "canonical_latex": null,
      "latex_sha256": null,
      "formula_mode": null,
      "relation": null,
      "source_evidence": [{"kind": "source_text", "locator": "Method 3.1, Eq. (1)", "detail": "The MLLM encoder produces semantic visual features e_v."}],
      "notes": ""
    },
    {
      "authority_item_id": "AUTH-0008",
      "subject_id": "region.wm-encoder",
      "kind": "SEMANTIC_REGION",
      "disposition": "CONFIRMED",
      "criticality": "critical",
      "bbox_source": {"x": 188, "y": 400, "w": 125, "h": 79},
      "text": null,
      "label": "World Model Encoder",
      "canonical_latex": null,
      "latex_sha256": null,
      "formula_mode": null,
      "relation": null,
      "source_evidence": [{"kind": "source_text", "locator": "Method 3.1, Eq. (1)", "detail": "The RSSM-based world-model encoder produces the latent dynamic state s_t."}],
      "notes": "The target uses the abbreviation WM; exact visible wording awaits review."
    },
    {
      "authority_item_id": "AUTH-0009",
      "subject_id": "region.modular-fusion",
      "kind": "SEMANTIC_REGION",
      "disposition": "CONFIRMED",
      "criticality": "critical",
      "bbox_source": {"x": 428, "y": 208, "w": 446, "h": 297},
      "text": null,
      "label": "Layer-wise semantic/dynamics expert fusion",
      "canonical_latex": null,
      "latex_sha256": null,
      "formula_mode": null,
      "relation": null,
      "source_evidence": [{"kind": "source_text", "locator": "Method 3.1, Eqs. (2)-(5)", "detail": "TAMF stacks dual semantic and dynamics expert adapters with task-conditioned routing."}],
      "notes": "Contains task-specific paths and layers 1, 2, 3, ..., l."
    },
    {
      "authority_item_id": "AUTH-0010",
      "subject_id": "region.behavior-learning",
      "kind": "SEMANTIC_REGION",
      "disposition": "CONFIRMED",
      "criticality": "critical",
      "bbox_source": {"x": 980, "y": 107, "w": 432, "h": 412},
      "text": null,
      "label": "Task-Aware Behavior Learning",
      "canonical_latex": null,
      "latex_sha256": null,
      "formula_mode": null,
      "relation": null,
      "source_evidence": [{"kind": "source_text", "locator": "Method 3.2", "detail": "Behavior learning combines task-conditioned imagination, dense reward, policy and rollout."}],
      "notes": ""
    },
    {
      "authority_item_id": "AUTH-0011",
      "subject_id": "region.task-imagination",
      "kind": "SEMANTIC_REGION",
      "disposition": "CONFIRMED",
      "criticality": "critical",
      "bbox_source": {"x": 993, "y": 121, "w": 400, "h": 91},
      "text": null,
      "label": "Task-conditioned imagination",
      "canonical_latex": null,
      "latex_sha256": null,
      "formula_mode": null,
      "relation": null,
      "source_evidence": [{"kind": "source_text", "locator": "Method 3.2, Eqs. (7)-(10)", "detail": "Mapped task states form an imagined task-aligned trajectory and dense reward reference."}],
      "notes": ""
    },
    {
      "authority_item_id": "AUTH-0012",
      "subject_id": "region.rollout",
      "kind": "SEMANTIC_REGION",
      "disposition": "CONFIRMED",
      "criticality": "critical",
      "bbox_source": {"x": 993, "y": 281, "w": 400, "h": 174},
      "text": null,
      "label": "World-model policy rollout",
      "canonical_latex": null,
      "latex_sha256": null,
      "formula_mode": null,
      "relation": null,
      "source_evidence": [{"kind": "source_text", "locator": "Method 3.2, Eq. (6)", "detail": "Policy actions and learned transitions iteratively generate an imagined latent trajectory."}],
      "notes": ""
    },
    {
      "authority_item_id": "AUTH-0013",
      "subject_id": "region.joint-optimization",
      "kind": "SEMANTIC_REGION",
      "disposition": "CONFIRMED",
      "criticality": "critical",
      "bbox_source": {"x": 187, "y": 545, "w": 422, "h": 54},
      "text": null,
      "label": "MLLM-WM Joint Optimization",
      "canonical_latex": null,
      "latex_sha256": null,
      "formula_mode": null,
      "relation": null,
      "source_evidence": [{"kind": "source_text", "locator": "Method 3.3, Eqs. (11)-(14)", "detail": "A unified objective couples semantic alignment, dynamics prediction and behavior optimization."}],
      "notes": ""
    },
    {
      "authority_item_id": "AUTH-0014",
      "subject_id": "region.environment",
      "kind": "SEMANTIC_REGION",